{
  "contract": "doc-source-map",
  "contractVersion": "0.1.0-draft",
  "id": "docmap:fixture:browser-panel-profile-card",
  "producer": {
    "name": "@hia-doc/browser-panel-fixture",
    "version": "0.1.0"
  },
  "artifacts": [
    {
      "id": "artifact:js",
      "kind": "generated-javascript",
      "path": "dist/profile-card.js",
      "language": "javascript"
    }
  ],
  "sources": [
    {
      "id": "source:ts",
      "kind": "source",
      "path": "src/profile-card.ts",
      "language": "typescript",
      "sourcesContentPolicy": "none"
    }
  ],
  "sourceMaps": [
    {
      "id": "sourcemap:profile-card",
      "kind": "ordinary-source-map",
      "path": "maps/profile-card.js.map",
      "language": "json"
    }
  ],
  "chains": [],
  "entries": [
    {
      "id": "entry:profile-card-render",
      "kind": "symbol",
      "symbolId": "ts:function:renderProfileCard",
      "symbolKind": "ts-function",
      "sourceRefs": [
        {
          "sourceId": "source:ts",
          "range": {
            "start": { "line": 6, "column": 1 },
            "end": { "line": 8, "column": 24 }
          },
          "rangeSource": "parser",
          "confidence": "high"
        }
      ],
      "artifactRefs": [
        {
          "artifactId": "artifact:js",
          "rangeSource": "source-map",
          "confidence": "high"
        }
      ],
      "diagnostics": []
    }
  ],
  "privacy": {
    "sourcesContentPolicy": "none",
    "allowAbsolutePaths": false,
    "allowUncPaths": false,
    "allowPathTraversal": false
  },
  "diagnostics": []
}
